{
  "requestId": "RND-FIXTURE-001",
  "status": "RENDERED_DRAFT",
  "artifactId": "ART-RND-FIXTURE-001",
  "portableMediaPath": "projects/vs-001-source-to-campaign/remotion/renders/vs-001-smoke.mp4",
  "fileSha256": "cccccccccccccccccccccccccccccccccccccccccccccccccccccccccccccccc",
  "normalizedFrameDigest": "dddddddddddddddddddddddddddddddddddddddddddddddddddddddddddddddd",
  "normalizedAudioDigest": null,
  "profile": {
    "width": 1080,
    "height": 1920,
    "fps": 30,
    "durationInFrames": 90
  },
  "humanReview": "pending",
  "runtimeLicenseStatus": "unresolved",
  "coverageGaps": ["runtime_commercial_license_unresolved", "human_review_pending"]
}
